{
  "chronological_loss_deltas": [
    {
      "asset": "ALL",
      "delta_b1v3": 0.013131355212549453,
      "fold": 101,
      "observation_count": 3910,
      "positive_value_favors": "B1v3a",
      "scope": "GLOBAL",
      "session_count": 10,
      "session_tercile": "ALL"
    },
    {
      "asset": "AAPL",
      "delta_b1v3": 0.027313309527052975,
      "fold": 101,
      "observation_count": 651,
      "positive_value_favors": "B1v3a",
      "scope": "ASSET",
      "session_count": 10,
      "session_tercile": "ALL"
    },
    {
      "asset": "AMZN",
      "delta_b1v3": 0.001283133747661678,
      "fold": 101,
      "observation_count": 649,
      "positive_value_favors": "B1v3a",
      "scope": "ASSET",
      "session_count": 10,
      "session_tercile": "ALL"
    },
    {
      "asset": "META",
      "delta_b1v3": 0.006935593244868879,
      "fold": 101,
      "observation_count": 660,
      "positive_value_favors": "B1v3a",
      "scope": "ASSET",
      "session_count": 10,
      "session_tercile": "ALL"
    },
    {
      "asset": "MSFT",
      "delta_b1v3": 0.013961529521171682,
      "fold": 101,
      "observation_count": 657,
      "positive_value_favors": "B1v3a",
      "scope": "ASSET",
      "session_count": 10,
      "session_tercile": "ALL"
    },
    {
      "asset": "NVDA",
      "delta_b1v3": 0.0013218803257707729,
      "fold": 101,
      "observation_count": 657,
      "positive_value_favors": "B1v3a",
      "scope": "ASSET",
      "session_count": 10,
      "session_tercile": "ALL"
    },
    {
      "asset": "TSLA",
      "delta_b1v3": 0.028476711895707225,
      "fold": 101,
      "observation_count": 636,
      "positive_value_favors": "B1v3a",
      "scope": "ASSET",
      "session_count": 10,
      "session_tercile": "ALL"
    },
    {
      "asset": "ALL",
      "delta_b1v3": 0.007665016148679405,
      "fold": 101,
      "observation_count": 1136,
      "positive_value_favors": "B1v3a",
      "scope": "SESSION_TERCILE",
      "session_count": 10,
      "session_tercile": "first"
    },
    {
      "asset": "ALL",
      "delta_b1v3": 0.01725833692610416,
      "fold": 101,
      "observation_count": 1223,
      "positive_value_favors": "B1v3a",
      "scope": "SESSION_TERCILE",
      "session_count": 10,
      "session_tercile": "last"
    },
    {
      "asset": "ALL",
      "delta_b1v3": 0.013880847501962069,
      "fold": 101,
      "observation_count": 1551,
      "positive_value_favors": "B1v3a",
      "scope": "SESSION_TERCILE",
      "session_count": 10,
      "session_tercile": "middle"
    },
    {
      "asset": "ALL",
      "delta_b1v3": -0.03158378344962749,
      "fold": 102,
      "observation_count": 3948,
      "positive_value_favors": "B1v3a",
      "scope": "GLOBAL",
      "session_count": 10,
      "session_tercile": "ALL"
    },
    {
      "asset": "AAPL",
      "delta_b1v3": -0.01083973694555957,
      "fold": 102,
      "observation_count": 660,
      "positive_value_favors": "B1v3a",
      "scope": "ASSET",
      "session_count": 10,
      "session_tercile": "ALL"
    },
    {
      "asset": "AMZN",
      "delta_b1v3": 0.007410566604497396,
      "fold": 102,
      "observation_count": 657,
      "positive_value_favors": "B1v3a",
      "scope": "ASSET",
      "session_count": 10,
      "session_tercile": "ALL"
    },
    {
      "asset": "META",
      "delta_b1v3": -0.009852275576033244,
      "fold": 102,
      "observation_count": 657,
      "positive_value_favors": "B1v3a",
      "scope": "ASSET",
      "session_count": 10,
      "session_tercile": "ALL"
    },
    {
      "asset": "MSFT",
      "delta_b1v3": 0.03277406528364652,
      "fold": 102,
      "observation_count": 654,
      "positive_value_favors": "B1v3a",
      "scope": "ASSET",
      "session_count": 10,
      "session_tercile": "ALL"
    },
    {
      "asset": "NVDA",
      "delta_b1v3": -0.0200451246381858,
      "fold": 102,
      "observation_count": 660,
      "positive_value_favors": "B1v3a",
      "scope": "ASSET",
      "session_count": 10,
      "session_tercile": "ALL"
    },
    {
      "asset": "TSLA",
      "delta_b1v3": -0.1880890974470654,
      "fold": 102,
      "observation_count": 660,
      "positive_value_favors": "B1v3a",
      "scope": "ASSET",
      "session_count": 10,
      "session_tercile": "ALL"
    },
    {
      "asset": "ALL",
      "delta_b1v3": -0.014062643300338311,
      "fold": 102,
      "observation_count": 1140,
      "positive_value_favors": "B1v3a",
      "scope": "SESSION_TERCILE",
      "session_count": 10,
      "session_tercile": "first"
    },
    {
      "asset": "ALL",
      "delta_b1v3": -0.05170471751375271,
      "fold": 102,
      "observation_count": 1253,
      "positive_value_favors": "B1v3a",
      "scope": "SESSION_TERCILE",
      "session_count": 10,
      "session_tercile": "last"
    },
    {
      "asset": "ALL",
      "delta_b1v3": -0.028215660869460785,
      "fold": 102,
      "observation_count": 1555,
      "positive_value_favors": "B1v3a",
      "scope": "SESSION_TERCILE",
      "session_count": 10,
      "session_tercile": "middle"
    },
    {
      "asset": "ALL",
      "delta_b1v3": -0.004534578561650118,
      "fold": 103,
      "observation_count": 3719,
      "positive_value_favors": "B1v3a",
      "scope": "GLOBAL",
      "session_count": 10,
      "session_tercile": "ALL"
    },
    {
      "asset": "AAPL",
      "delta_b1v3": -0.01417283660844906,
      "fold": 103,
      "observation_count": 602,
      "positive_value_favors": "B1v3a",
      "scope": "ASSET",
      "session_count": 10,
      "session_tercile": "ALL"
    },
    {
      "asset": "AMZN",
      "delta_b1v3": -0.00032434570418966554,
      "fold": 103,
      "observation_count": 621,
      "positive_value_favors": "B1v3a",
      "scope": "ASSET",
      "session_count": 10,
      "session_tercile": "ALL"
    },
    {
      "asset": "META",
      "delta_b1v3": -0.0012205319543626726,
      "fold": 103,
      "observation_count": 624,
      "positive_value_favors": "B1v3a",
      "scope": "ASSET",
      "session_count": 10,
      "session_tercile": "ALL"
    },
    {
      "asset": "MSFT",
      "delta_b1v3": -0.0027595540630982332,
      "fold": 103,
      "observation_count": 624,
      "positive_value_favors": "B1v3a",
      "scope": "ASSET",
      "session_count": 10,
      "session_tercile": "ALL"
    },
    {
      "asset": "NVDA",
      "delta_b1v3": -0.008696614463265254,
      "fold": 103,
      "observation_count": 624,
      "positive_value_favors": "B1v3a",
      "scope": "ASSET",
      "session_count": 10,
      "session_tercile": "ALL"
    },
    {
      "asset": "TSLA",
      "delta_b1v3": -0.00035315745226850855,
      "fold": 103,
      "observation_count": 624,
      "positive_value_favors": "B1v3a",
      "scope": "ASSET",
      "session_count": 10,
      "session_tercile": "ALL"
    },
    {
      "asset": "ALL",
      "delta_b1v3": 0.002534078702137505,
      "fold": 103,
      "observation_count": 1138,
      "positive_value_favors": "B1v3a",
      "scope": "SESSION_TERCILE",
      "session_count": 10,
      "session_tercile": "first"
    },
    {
      "asset": "ALL",
      "delta_b1v3": -0.008038646796887794,
      "fold": 103,
      "observation_count": 1121,
      "positive_value_favors": "B1v3a",
      "scope": "SESSION_TERCILE",
      "session_count": 9,
      "session_tercile": "last"
    },
    {
      "asset": "ALL",
      "delta_b1v3": -0.00735380559897127,
      "fold": 103,
      "observation_count": 1460,
      "positive_value_favors": "B1v3a",
      "scope": "SESSION_TERCILE",
      "session_count": 10,
      "session_tercile": "middle"
    }
  ],
  "collinearity": {
    "complete_row_count": 23134,
    "condition_number": 8.770877471091737,
    "condition_number_nonfinite": false,
    "feature_count": 14,
    "matrix_rank": 14,
    "max_absolute_pairwise_correlation": 0.9433814233187358,
    "max_correlation_pair": [
      "b0v2_spy_rv_30m",
      "b0v2_qqq_rv_30m"
    ],
    "rank_deficient": false,
    "zero_variance_features": []
  },
  "diagnostic_families": [
    "SOURCE_AND_NESTED_FEATURE_COVERAGE",
    "QUOTE_QUALITY_AND_SESSION_CONCENTRATION",
    "IV_INVERSION_AND_GEOMETRY",
    "EXACT_WITHIN_SESSION_LAGS",
    "FEATURE_SCALE_AND_TAILS",
    "COLLINEARITY_AND_GAMMA_SPECIFICATION",
    "CHRONOLOGICAL_LOSS_AND_TEMPORAL_DRIFT"
  ],
  "feature_distributions": [
    {
      "feature": "b1v3_log_atm_variance_30d",
      "finite_count": 25521,
      "mean": -2.1448222620779718,
      "median": -2.3178608546681203,
      "missing_or_nonfinite_count": 183,
      "near_constant": false,
      "p05": -3.4272202052798417,
      "p95": -0.8887128903824394,
      "row_count": 25704,
      "standard_deviation": 0.810366805899804
    },
    {
      "feature": "b1v3_log_atm_variance_change_5m",
      "finite_count": 25038,
      "mean": -0.00042446509723643994,
      "median": -0.0005708903446430824,
      "missing_or_nonfinite_count": 666,
      "near_constant": false,
      "p05": -0.013813240092301648,
      "p95": 0.013753919657861557,
      "row_count": 25704,
      "standard_deviation": 0.01038521123916589
    },
    {
      "feature": "b1v3_log_atm_variance_change_30m",
      "finite_count": 23238,
      "mean": -0.002473524382428146,
      "median": -0.0027408582237229417,
      "missing_or_nonfinite_count": 2466,
      "near_constant": false,
      "p05": -0.030079746421356534,
      "p95": 0.026153507902250933,
      "row_count": 25704,
      "standard_deviation": 0.0188392260323698
    }
  ],
  "gamma_coefficients": [
    {
      "coefficient": -11.510055656083384,
      "feature": "__INTERCEPT__",
      "information_set": "B0",
      "scale": "GAMMA_LOG_LINK",
      "selected_parameters_json": "{\"alpha\":0.0,\"max_iter\":2000,\"tol\":1e-08}"
    },
    {
      "coefficient": 0.1182510122100329,
      "feature": "numeric__b0v2_log_spot",
      "information_set": "B0",